<!ELEMENT dizionario (voce*)> 
<!ELEMENT voce (termine, pronuncia, significato+)>  
<!ELEMENT termine (#PCDATA)>
<!ELEMENT pronuncia (#PCDATA)> 
<!ELEMENT significato (definizione, esempio*)> 
<!ELEMENT definizione (#PCDATA)> 
<!ELEMENT esempio (#PCDATA)> 
<!ATTLIST dizionario lingua (english|french|german|italian|spanish) 'italian'>
